hyatt yogyakarta beautiful resort garden swim pool phenomenal include swim pool bar water slide ancient temple well restaurant serve excellent food breakfast buffet nice great spa site beyond hotel look gorgeous give peaceful feel areas attention room feel quite date especially bathrooms isolation could better breakfast box go early trip bite limit price bite steep compare hotels area overall really nice place stay,0.035,0.62,0.345,0.9788
friendly staff nice swim pool slide plus family nice bed lot breakfast choices definitely back next visit jogjakarta super happy,0.0,0.423,0.577,0.959
family wonderful stay hyatt regency hotel upon arrival greet warm smile hospitable staff welcome flower garland drink luggages send room check process smooth quick assist kind friendly staff name meirisa first night dinner restaurant offer great choices food drink great service purwanto ana ivan attentive friendly even try strike conversation ask day etc great service also irna help us book cab back airport ircha fast check process room clean bed comfortable wi fi work well hallway lobby smell span span hellip,0.013,0.567,0.42,0.9922
although locate bite far malioboro worth stay hyatt check process fast room nice food delicious also jog around hotel property,0.0,0.669,0.331,0.8126
beautiful hotel style surround temples fantastic service always smile great food club room well worth little extra spend super choice pool facilities maybe lack additional choice restaurant definitely come back,0.048,0.44,0.512,0.9688
hotel area extensive property lot facilities swim spa health club golf kid horse rid free bike even camp half full day want time spouse make sure great time hotel staff care helpful take extra care vegetarian meals sometimes create recommend specially chef food hotel overall stun property artworks meals pool stone structure tree house son love make use little nooks throughout property choose room balcony possible yoga paint sessions create perfect family getaway yogyakarta culturally span span hellip,0.0,0.655,0.345,0.9859
room old sheet towel stain not really standards hyatt aside large property extensive pool perhaps worth consider stay elsewhere,0.0,0.905,0.095,0.2263
good place ease mind art lover could spend hours observe sculpture art exhibition stay spend hours look paint love every piece room spacious choose room balcony spend hours balcony nice scenery love everything hotel,0.0,0.579,0.421,0.9657
hotel good service guest room check service fast eventhough problem f amp b package list email hotel note solve quickly many pool hotel make guest comfortable choose,0.085,0.662,0.252,0.6486
go new year eve countdown party hotel great one food entertainment actives wish lanterns stay next day nights despite high season still great time pool hotel recommend like resort type stay soak pool enjoy garden,0.0,0.493,0.507,0.9769
honestly think hyatt chain audit hotel would lose star license carry name quite lot write give know would probably not go begin choose different hotel main reason room zero isolation every wake minerate corridor non stop noise neighbour top side watch tv listen isolation noise also problem massage listen live concert nearby not soothe calm want first day shower hot water warm ish not nice shower breakfast good excellent quality much choose however span span hellip,0.215,0.646,0.139,-0.6515
first impression upon arrival impressive full big tree garden lawn lobby decoration look good crowd room decoration conventional bite run air condition room not good temperature ok hygrometer show humidity wake,0.048,0.641,0.31,0.8486
hotel look amaze detail show carelessness dirty rugs lobby towel available pool morning old tiny bath tubs staff really friendly nice rude consistency service recieve,0.227,0.477,0.296,0.3834
first day arrive pleasant check wife enjoy happy hours club lounge indonesian vegetarian options specify curious prepare well chef riva give us indian rasam curry white rice potato dish sandwich,0.0,0.631,0.369,0.9274
favourite place getaway great food ambience scenery mt merapi plenty swim poolsstaff warm friendly restaurant great job food terrific breakfast buffet huge selection,0.0,0.476,0.524,0.9565
hotel environment great breakfast buffet selection not bad cleanliness restaurant need improve hotel restaurant staff need pro active fulfill hotel guests need,0.0,0.524,0.476,0.9377
finish night stay could not happier service club lounge experience hotel bite center town may may not issue depend jogja grab uber cheap plentiful although traffic bear ground parklike expect since hotel really golf resort nice k jog track ground pool complex neat kid several pool wind way around standalone fitness room tiny require walk past pool room furnish date everything good condition space adequate place really shin service food club lounge experience service really top notch nearly span span hellip,0.031,0.804,0.166,0.8829
stay hyatt regency presidential suite nights last week december hotel arrange airport transfer inr driver wait us upon exist baggage claim check breeze suite top floor view mt merapati pool golf course room two full bathrooms live room kitchen massive wrap around balcony patio table sun lounge chair dvd cd player nose surround sound although dvd not connect directly tv hdmi cable solve suite include access lounge ample drink alcoholic non well hors oeuvres essentially like dinner desk lobby arrange span span hellip,0.0,0.893,0.107,0.743
little tough review experience place mix bag check horrendous take nearly two hours due inefficiency confusion reservation spite contact hotel advance first room assign standard room disgraceful towel one robe slippers non function internet bathroom straight depress extremely date like one would see old person home us do update since buy house shower tub combo ancient tile work raise stink eventually move club room book room better still old nice marble bathroom separate span span hellip,0.178,0.711,0.112,-0.7293
hyatt regency yogyakarta sprawl property even golf course inside room spacious property many activities age spa good complimentary jacuzzi sauna one also take complimentary bicycle interestingly hour menu hotel good vegetarian choice try roti canai green fry rice,0.0,0.698,0.302,0.9231
book room trip yogyakarta wife staff helpful friendly food taste fantistic room clean tidy first get keep way til end stay,0.0,0.674,0.326,0.8271
stay hotel one conference mesmerize tranquility garden come back months later whole family top aspect resort hotel tropical garden multiple pool lovely place relax sightsee nearby attractions conveniently locate half way airport yogja downtown great need faster access airport however one need note relatively far yogja walk min without traffic free shuttle bus stop pm hotel great age room need renovation good customer service although not personal restaurant adequate standard weekend gala dinner life music open buffet highly recommend span span hellip,0.063,0.669,0.268,0.9699
recently stay nights amaze time service fantastic everyone smile acknowledge staff friendly make two little boys feel special welcome enjoy pool slide smaller shallower pool younger kid end use ground entrance stun enjoy regency club benefit truly recommend room bed comfortable clean think lovely touch cute portacot youngest set would definitely stay return jogyakarta,0.0,0.439,0.561,0.993
hotel recommend vacation business purpose great room lot fine decorative arts large swim pool beautiful park golf park staff hotel helpful check fast good service recommend stay yogyakarta,0.0,0.506,0.494,0.9612
wife go yogjakarta honeymoon choose hyatt regency place stay moment arrive hotel felt welcome hotel staff room perfect hotel beautiful,0.0,0.616,0.384,0.891
stay many star hotels never experience extra level hospitality im love team ere attentive also best spa town food great th,0.0,0.59,0.41,0.926
spend week rather age still good condition resort yogyakarta love every bite stay room basic ground hotel blow away hotel golf course attach jog trail gym room rather small effective necessary machine food din heavenly staff polite helpful hotel club house live music karaoke days dance lovely music friends one nights love ambiance meet hotel gm gracious person attend christmas tree light ceremony hotel stay excite lot eat drink lovely choir hotel choice span span hellip,0.0,0.627,0.373,0.9903
stay lot art stuff like paint sculpture monument put place inside hotel keep change every day really make everyday look different really enjoy,0.0,0.778,0.222,0.7178
impressive check process facilities room quite old shower bed etc however nice environment around hotel take walk around golf course enjoy outside swim pool,0.0,0.693,0.307,0.8519
couple service staff quite outstanding overall ambience great suitable holiday retreat beautiful pool also add attractive feature anyone unwind laze around,0.0,0.432,0.568,0.9623
goof hotel however staff make excellent hotel return regularly future visit new friends look like family nothing could want even anniversary celebrate staff friends would impossible improve hotel without staff build good build everything work build,0.072,0.553,0.375,0.9466
excellent hotel wonderful pool splendid natural environment sumptuous breakfast nice service room service excellent try homemade squash one kind definitely come back,0.0,0.347,0.653,0.9783
stay honeymoon march welcome drink flower first service upon arrival hyatt regency staff warm helpful room comfort classic design decorate flower bed bathub request honeymoon breakfast delicious wide selection view merapi mountain wow factor imagine enjoy omelette sip earl grey tea look merapi view breathtaking view definetely one best star hotel yogyakarta,0.0,0.589,0.411,0.9805
good service good food especially like probably best price quality find yogyakarta service good waiter smile want help easy change room good view,0.0,0.315,0.685,0.9782
room need general clean specialy around hear bord litte bite dirty small black animal like breakfast food combine service etc good garden nice jog,0.088,0.579,0.332,0.7906
staff hyatt best staff ever extremely welcome helpful enjoyable welcome us refreshments picture later frame give us anniversary room fill roses throughout towel swan decor note staff staff go beyond tell enough great everyone us amenities great food breakfast delicious highly recommend hotel,0.0,0.517,0.483,0.9858
pleasurable stay hyatt regency yogyakarta impress room use suite upgrade service receive e g able get help pack early breakfast trip borobudur get cab us early hours morning back future,0.0,0.735,0.265,0.8402
wonderful sprawl resort yogyakarta offer much good night sleep one best hotel region offer endless lush garden relax free shape pool excellent food spacious room ok room could get bite modernize get authentic feel indonesia architecture overall style would recommend choose club room come complimentary afternoon food drink function private check desk concierge hotel min drive airport min city center major malls enjoy location could disconnect outside world relax perfect chill explore amaze yogyakarta region detail review tons photos visit span span hellip,0.0,0.627,0.373,0.991
wonderful breakfast excellent many variety food combine traditional international food amp beverages hotel clean well maintain highly recommend hotel,0.0,0.483,0.517,0.9324
stay hyatt nights depart bali check departure service excellent every staff member helpful attentive unable help would ask someone else assist travel desk excellent quick efficient honest options available worth not try sell expensive thing push anything may not want daily breakfast great offer plenty variety everyone palate alcohol selection could better keep mind part world property beautiful well maintain well pool gym facilities location great minutes center town span span hellip,0.012,0.584,0.404,0.9898
day stay amaze service believe award great food options really considerate accommodate hotel travel desk completely take care local site see options property huge well take care minor remodel even notice,0.0,0.473,0.527,0.9768
build inspire borobudur temple room view face greenery park golf seclude yet not far city centre recommend hotel either business couple leisure even family leisure,0.0,0.788,0.212,0.7351
please put direction sign lift room cosy garden pool area beautiful many areas take picture breakfast area nice near pool good distance many candi jejamuran car,0.0,0.649,0.351,0.8979
hi stay hyatt yogya american would not say really hyatt standard nice comfortable really affordable option visit many temples attraction around room normal nice view overlook park huge walk closet bathroom ok except hot water take good min come restaurant nice huge selection breakfast feel bite busy probably guest eat time waiters staff extremely sweet helpful poolside nice slide activities kid overall nice hotel would recommend good option,0.0,0.552,0.448,0.9906
stay celebrate years anniversary fast check process staff welcome friendly nice room special set treatment thank staff hyatt regency yogyakarta especially many thank bapak ateng aditya director room help arrange prepare everything stay memorable,0.0,0.53,0.47,0.9686
stay regency club room two night check process quick easy room spacious neat inform hotel honeymoon trip hotel give roses petal bed bathtub nice treat wife really like breakfast great lot options buffet choose eat pool side view great since stay regency club every even hotel provide even cocktail varieties small bite free flow wine alcohol drink overall nice honeymoon,0.0,0.637,0.363,0.9818
positives staff accommodate pleasant deal food great mix western local cuisine many type sambal chefs happy talk great events hotel like night market ramayana ballet well put together spa affordable good shiatsu massage therapists accommodate need move appointments make beautiful pool surprise water slide ground hotel magical great landscape truly breathtaking extra room options available pillow menu request iron razor etc location great visit borobudur prambanan major temples constructive feedback would handy tell pack lunch would available collection site span span hellip,0.0,0.595,0.405,0.9928
hotel tranquil calm great place nothing pleasure kid love fast swim pool water slide unfortunately small one break still enjoy experience nevertheless,0.254,0.434,0.312,0.2579
excellent hotel lot care amp friendly staff many facilities amp beautiful scenery around breakfast buffet great enough one personally like hot water always amp water pressure strong bath time great truly go wrong stay hotel hotel give please experience amp give,0.079,0.43,0.492,0.9816
days attention warm attention excellent hotel offer many activities family beautiful landscape not think twice stay hotel,0.0,0.596,0.404,0.8591
always want come back hotel everytime visit yogyakarta staff kind helpful sincerely give best effort accommodate request restaurant garden jog track hotel surround view beautiful food delicious room nice well bathroom wish room floor cover larger carpet since quite cold morning walk barefoot inside room better thoroughly maintenance would require since quite old build,0.0,0.567,0.433,0.9847
hyatt one best hotel family visit compare star hotel around indonesia second visit still love everything even kid love stay,0.0,0.574,0.426,0.9274
family two nights good present experience overall check departure even though spend must time premise always sight see whenever back always nice service welcome atmosphere,0.0,0.717,0.283,0.8271
nice hotel clean room tasty food beverage scatter full choices breakfast menu big pool slide friendly staf recommend family trip spacious room kid love nasi goreng,0.0,0.577,0.423,0.9371
hyatt regency yogyakarta best place stay family come back stay hyatt yogyakarta place big really like feel green koi fish hope start renew president suite old,0.0,0.699,0.301,0.8718
wanna say thank hyatt service facility perfect visit jogja stay hotel completely wonderful felt choose right way back family feel atmosphere jogjakarta hotel perfect,0.0,0.59,0.41,0.9312
staff nice amp helpfull hotel room not modern overall nice suggest hotel separate floor smoke amp non smoke area not really healthy baby along hallway smoke free sign check rule really strict need flexible guests baby,0.056,0.696,0.248,0.8219
days spend amaze hotel excite people cheerful kind love food indonesian western sport facility e swim pool gym clean suitable us one never forget wife love nasi merah brown rice know hotel serve kind rare thing us thank hyatt back,0.0,0.474,0.526,0.9851
stay hotel around days quite surprise comfortable kid get think slide pool good job food nice staff definitely pleasant helpful place quite view nice balcony add advantage ask view volcano really look splendid leave phone taxi staff quick call company sort issue go back less mins recommend always,0.021,0.521,0.457,0.982
second time hotel great stay fantastic helpful staff say previous review downside hotel little tire assure possibility upgrade future big shout thank nur hotel manager wonderful stay,0.049,0.49,0.461,0.9503
stay nights today first day staff friendly hotel nice today hotel guests cannot sit outside event people outside book whole terrace frustrate vacation not sit inside like st home,0.142,0.692,0.166,0.224
husband go yogyakarta short weekend gateaway celebrate year wed anniversary choose hyatt get marry grand hyatt singapore stay turn perfect staff decorate club king room happy anniversary flag window bouquet roses thoughtful staff truly wonderful warm offer much useful information yogyakarta,0.0,0.532,0.468,0.9801
wed spend time hotel massage spa drink pool delicious local food hotel restaurant great time round good families,0.0,0.584,0.416,0.8934
come hotel feel like nd home awesome ambiance view balcony room especially view mount merapi garden golf field breakfast always best attendants kemangi chef sugeng know favourite start lemon honey bacon lava egg gudeg assort traditional food fresh juice fresh fruit double espresso front desk staff kind fitri need refurbish room still ok view best service,0.0,0.656,0.344,0.9756
thoroughly enjoy week stay connect club room family incl son amp daughter maid clean comfortable rustic view pool amp lush vegetation book connect club room convenient enable us enjoy inclusive breakfast cocktails excellent dish kid first time chicken caesar salad make order superb night local delicacies freshly prepare beautifully present delightful ground kid club welcome bbq events throughout week make relax stay course pool extensive slide big hit son learn finish thank henry kid club lastly complementary minibus malioboro shop span span hellip,0.0,0.662,0.338,0.9888
first time hyatt definitely want come back absolutely beautiful big hotel love restaurant swim pool even slide definetely recommend family trip athere free jacuzzi pool well,0.0,0.484,0.516,0.9601
stay mom right ied mubarak year city become way crow tourist decide spend time hotel hotel perfect occasion mom lovely walk around follow path along golf next hotel help not fall love pool breakfast huge great love every food also cappuchino oh wait back enjoy beutifull resort,0.103,0.595,0.302,0.9196
first time hyatt definitely want come back absolutely beautiful big hotel locate bite far away busy yogyakarta downtown offer free shuttle malioboro depart every hour feel need go outside hotel use days relax basically need inside resort variety good food modest price pool stun much fun waterslide staff friendly helpful room average size look like refresh quite however always clean put together recommend,0.0,0.596,0.404,0.9856
staff nice room spacious provide variety indonesian chinese western breakfast amp pool amazingly big everything go ok except disturb early morning loud speaker event hold outside kinda hop peaceful morning,0.074,0.71,0.216,0.6395
hotel nicely situate calm green area great view arrive company rent premise celebration mean lot loud music till late night crowd restaurants room quite small compare others stay price look like renovate quite time still clean keep good order breakfast good kid really like huge pool waterslide good destination want visit borobudur prambanan,0.0,0.585,0.415,0.9795
good clean part room hotel good interactive guess enough far away crowd traffic yogyakarta downtown good food beverage many selection good price hotel location,0.0,0.571,0.429,0.9231
everything good suggestion hotel check condition chair sofa room every day week reference cushion abnormal condition also please check ventilation system smoke floor,0.0,0.802,0.198,0.6369
hotel especially ground beautiful pool lot small seat areas feel private breakfast every morning great much choice asian european food fresh fruit egg waffle station even possibility smoothie make room nice perfect size bed good bathroom could update use free shuttle city center every day rins every hour reserve advance seat never issue,0.0,0.664,0.336,0.9728
friend amaze stay staff welcome kind despite often odd request cater delicious cook class great enjoy cycle tour would recommend wear helmets road pretty bumpy thank much great stay,0.0,0.307,0.693,0.9894
actually stay hyatt room book however touch tour desk angsa tour even though stay elsewhere organise borobudur tour day excellent tour guide yun excellent informative disappointment seem take long way back villages mean go time charge extra hour disappoint not choice go way base great information yun give us decide prambanan temple follow day able accommodate us follow day pay advance cannot believe charge us price borobudur prambanan much closer guide not know span span hellip,0.083,0.787,0.129,0.7269
stay hyatt regency yogyakarta nights mix review though overall complaints probably nitpick start property spectacular stun every detail amaze golf course beautiful pool beautiful facilities beautiful complaints outside let go room mine adequate size much view also standard room shower bite small lbs felt really cramp shower would complaint staff excellent attentive friendly zero complaints fitness center well really thing gym actually size room couple span span hellip,0.131,0.571,0.298,0.9502
book room king bed actually queen size bed call front desk say king bed doors suite actual king bed housekeep admit definitely difference size two really trouble figure considreded ok feel like lie also book massage spa sure book day book mine pm mins start loud electronic music litteraky blast cafe next door hotel make impossible fully relax,0.044,0.743,0.214,0.8658
experience stay outdoor part restaurant breakfast dinner great unforgettable tree cover restaurant make outdoor part restaurant look feel natural cool newly add glass roof ensure guests not get wet rain thus not need leave premise,0.0,0.703,0.297,0.8921
attractive hotel environment lovely garden spacious well equip comfortable room consistent better hyatt regency hotels elsewhere great buffet breakfast excellent local international cuisine great service pleasant clubroom limit din great multiple cascade swim pool,0.0,0.412,0.588,0.9875
originally yogya always stay hyatt regency yogyakarta every time come partner visit family yogyakarta time come laws well hyatt go extra miles make sure stay amaze laws happy service always felt home place swim pool garden exquisite well groom breakfast buffet best ever,0.0,0.674,0.326,0.9509
perfect hotel staycation beautiful view make us comfortable relax love ambiance pool think room time renovate awesome good luck hyatt,0.0,0.3,0.7,0.9818
world hyatt hyatt regency yogyakarta unique pyramid architecture hotel build second one location suburb city taxi easily hire anytime park lot customers want visit malioboro boulevard green plantation well cultivate along multi level pool golf court main build walk distance convenient store find along streets not isolate old hotels good maintenance years facilities wear acceptable style elevators seem antique still work room rat correctly aim luxury market competitive town therefore popular meet events couple family golf span span hellip,0.0,0.806,0.194,0.92
food service accommodation excellent friendly staff prompt service great facilities indoors kid really enjoy pool treehouse track run walk restaurant club reasonable price spacious terrace outside hotel lobby large beautiful neat tidy landscape garden cultural artefacts convenience store hotel proximate easy access malls cab hail hotel extra cost,0.0,0.594,0.406,0.9769
recommend hotel business family vacation location not far downtown clean quiet place perfect refresh taste food good staff nice friendly thumb,0.07,0.464,0.467,0.916
great star hotel garden view scenic golf course room standard love balcony garden golf course view parent stay president suite room spacious service excellent staff helpful friendly swim pool great gym whirlpool not great water temperature swim pool breakfast buffet great great variety thing wait time omelette one chef make omelette overall really enjoy stay hotel,0.0,0.548,0.452,0.9905
simply perfect hotel top notch every element reasonable price outside busy areas yogya situate beautiful ground everything need big pool good spa sport facilities tour agency lobby breakfast good lunch options special bar late afternoon drink buffet different theme every even unlike average hotel buffet pretty good one even even full fledge ramayana ballet performance include live musicians dozen actors importantly staff friendly experience really make feel home,0.0,0.651,0.349,0.981
golf tour java stay hyatt enjoy round hole scenic golf course stay hyatt club room service standard excellent great bed comfortable club lounge breakfast increase waistline pool garden sublime,0.0,0.591,0.409,0.9485
