check late night nights stay surprise welcome flower welcome drink lobby nice cozy front desk clerk little trouble find reservation bell boy really helpful show room corridor nice fresh flower decoration room temperature quite warm engineer staff fix promptly fix problems room neat clean breakfast buffet exceptional variety local international food dinner kenangi bistro nice memorable waiter need little bite train dinner set make perfect please prepare spare time leave airplane traffic jam additional minutes regular travel time,0.061,0.585,0.354,0.981
formidable tandem ibu yulia mas daniel make stay hyatt regency seamless guest practically part globe rave warm hospitality excellent arangements good food nice friendly hotel satff special even events whip guest amid relax atmosphere hyatt regency yogyakarta next time plan business meet go find ibu yulia mas daniel look forward ideas tandem could concoct team well do,0.0,0.688,0.312,0.9648
second time hotel keep improve check fast food good green areas amaze perfect relax city bustle still immerse javanese culture worth visit even day,0.0,0.503,0.497,0.9501
good experience business trip first stay felt amaze place hotel natural view wonderfull place service staff hyatt regency good help everything need thank,0.0,0.5,0.5,0.9432
hyatt regency hotel perfectly locate thirty minutes centre yogyakarta guests enjoy clean air relax beautifully keep pool garden areas still close vicinity major attractions buffet breakfast buffet breakfast come part hotel package tremendous value buffet offer range foods local indonesian cuisine individually make omelets buffet also offer vegetarian options fresh fruit cake pool pool service negative hotel would slowness service around pool area friend order lunch wait least hour food pool amaze pool different areas children adults could hang enjoy span span hellip,0.034,0.653,0.313,0.9825
stay nights club room excellent place value money landscape around hotel beautiful time go jog walk around lot variety breakfast buffet days serve different variety local breakfast arrive saturday straight away sign ramayana ballet buffet dinner never see real one good enough appreciation art enjoy also take grind tour angsa tour counter near lobby complaints either price maybe high side great service tour guide driver take note may restriction want eat,0.052,0.644,0.303,0.9682
love stay hyatt fresh lot green view addison like facility jog track swim pool golf area like also quality furniture decoration food good staff friendly,0.0,0.519,0.481,0.9485
excellent hotel yogyakarta must try regency room better pleasant experience not mention provide complementary buffet tea time free flow wine beer stay amaze greet director stay really humble attentive issue highlight guests overall hotel condition might seem little old time upgrade still comfortable spend time hotel garden still fit hotel theme touch prambanan borobudur monument,0.0,0.628,0.372,0.9781
stay hotel days business trip deluxe room great complete facilitate also offer good environment green everywhereeee swim pool great fantastic also really good service delicious indonesian western foods,0.0,0.505,0.495,0.9704
absolutely stun beauty around perfect well run hotel nice hole golf course good condition well train caddy excellent food good atmosphere clean good location day trip interest performance saturday night,0.0,0.366,0.634,0.9847
beautiful landscape modern javanese charm architecture nice breakfast buffett good value small bed room need change matrass completely renovate bathroom unfortunately free andong ride bad experience driver lazy unfriendly,0.232,0.394,0.374,0.7806
first come feel natural many tree pool mini river golf field many facilities location km city center okay good breakfast bed good night stay good sleep,0.0,0.616,0.384,0.9022
stay five nights hyatt regency yogjakarta stay wonderful service throughout stay overwhelm course five star hotel facilities room well maintain though go need renovations near future hotel build best thing hyatt regency yogjakarta ground hotel offer amaze pool area well golf course restaurants ground big lush green oasis perfect getaway traffic chaos city visit borobudr merapi hyatt excellent grind camp sight side city sure visit prambanan even beach not problem traffic jogja everywhere indonesia quite span span hellip,0.054,0.67,0.276,0.9689
overall pleasant stay hotel nice bite old room could use update front desk tour service housekeep general staff service par expect resort pool great super fun kid great water slide gym small well equip cardio weight train staff really nice great buffet lot yummy local food efficiency f amp b service need dramatically improve service extremely slow ala carte order even drink apply bistro poolside bogey teras lobby lounce staff seem fine individually management really need look overall system seem kitchen span span hellip,0.0,0.617,0.383,0.9907
spend full week hyatt regency yogyakarta july hotel locate quite area minutes city center beautiful hotel amaze ground large pool split several smaller pool different level make private lot small seat areas staff fantastic friendly helpful restaurant large outside seat area shade tree form large natural umbrellas food also nice good variety,0.0,0.636,0.364,0.9756
whole day stay hotel not bad specially stay hyatt regency yogyakarta beautiful quiet cozy kid friendly also perfect place hide away family,0.053,0.526,0.422,0.9178
one best superb hotel spread vast expanse land beautiful garden surround superb restaurant food impeccable service fantastic value money exactly high quality hotel expect provide highly recommend travelers borabudur less hour away,0.0,0.499,0.501,0.9778
stay years old hyatt regency yogjakarta first time look around town come conclusion like visitors us still best hotel yogjakarta vast areal surround green golf course big breakfast selection even buffet back anytime soon time permit best hotel nice pool also kid last not least would like mention dedicate service well,0.0,0.711,0.289,0.9538
stay almost every business visit yogyakarta service great sometimes inconsistent guests usual one time get sick stay bring medicine really helpful stick place preference stay since great swim pool children would love food breakfast good serve indonesian western food,0.06,0.603,0.336,0.9441
stay hotel husband year old daughter weekend hotel ground lovely lush clean stay quot club quot room recommend include complimentary drink substantial nibble pm room well appoint plush towel fresh fruit provide daily staff friendly helpful definitely back explore yogyakarta bogey terrace nice spot drink meal well find last day though,0.0,0.552,0.448,0.9812
hotel amaze hyatt service great breakfast one best see great staff ready answer question incredible friendliness comfortable room beautiful view take room balcony otherwise not chance open window room balcony open balcony door get fresh air spend great time,0.027,0.432,0.541,0.9875
feel warm indonesia ambience part huge garden decorate candi shape stone staff helpful breakfast provide indonesian menu love come back,0.0,0.588,0.412,0.8807
go yogyakarta hyatt decision lot new hotel open opinon best one still hyatt couldnt find room good view jog track golf course mountain view best food restaurant especially local traditional one excellent service else want find everything best one already,0.045,0.63,0.326,0.945
stay hyatt regency hotel nights days feb staff friendly n helpfull since first day arrive hotel room big enough occupy us bathroom clean n clean room twice day breafast delicious n lot choose hotel provide free shuttlebus malioboro theree lot activities u hotel bicycle ride dokar ride n golf think hyatt hotel yogyakarta golf field swim pool big kid enjoy swim,0.0,0.727,0.273,0.9571
several hyatts definitely one else hide gem take aback beauty green know hyatt fresh flower real plant hyatt superb greater garland jasmine flower famous fruit punch hot cold towel reception beautiful felt like go back time breakfast spread huge super delicious ramayana show dinner pool stun shall say pool little pond low guests fish fun football wall kid walk thru garden truly breathtaking room fresh flower fruit housekeep team really accommodate front office coffeehouse span span hellip,0.033,0.566,0.401,0.9904
stay three nights march swing business trip southeast asia ground stun huge beautiful pool complex phenomenal view mt merapi locally inspire architecture dinner buffet quite tasty breakfast outside patio highlight contribute surprise bare bone nature room felt like simply run money come time think decorate room even think mine anything wall matter much phenomenal property still seem,0.0,0.735,0.265,0.9432
stay hyatt regency yogyakarta night delightful experience hotel locate minutes airport without traffic ground lovely spend time relax outside beautiful view mt merapi next peaceful koi pond kristri reception helpful matea waitress restaurant attentive friendly really enjoy food reasonably price favorite pizza double cheese nila guest service helpful friendly pleasant make arrangements us go borobudur temple within hour arrival driver speak little english careful driver swim pool great clean relax overall property great span span hellip,0.027,0.523,0.45,0.993
hotel quite far anything swim pool go great really spend hours pool little disappoint breakfast items indonesian chinese familiar bite explanation local foods would helpful dish menu fantastic though bite issue room book arrive late plane delay result year old horrible mood exhaust even though staff saw state us fill bunch paperwork right fill anywhere else trip woman also make mention membership would fill us free span span hellip,0.122,0.716,0.162,0.659
stay nights absolutely enjoy every moment stay staff extremely friendly assist requirements wife vegan vegetarian go way provide food order recommend resorr family friends,0.0,0.614,0.386,0.9116
really impress beautiful hotel ground everything top class include great multilevel pool room really nice also excellent friendly service issue board pass really go way help one minor criticism restaurant attractive attentive service frankly not greatest food actually eat yogyakarta good anyway perfect place stay want visit truly awesome borobudur site,0.073,0.409,0.518,0.9891
room may small five star hotel nothing like lush garden golf course expansive swim pool take early morning walk jog well demarcate paths start sight see business meet cuisine excellent varieties day shuttle tourist centre town jogja famous malioboro balconies least room would plus luxury facility,0.041,0.845,0.114,0.5705
love hotel get fantastic deal agoda rent connect room king set twin nicely appoint tile bath could bite quot upscale quot line lobby ground offer absolutely fine spotlessly clean price good really complain perfectly locate close yogya craziness close prambadan easy drive borobudur want see sunrise rent hotel near borobudur short drive merapi ground lovely nice break jakarta pool giant slide kid set quot temple quot theme although slide kid could ride day also love waterfall pool wind around different pool span span hellip,0.047,0.607,0.345,0.9859
stay hyatt club room nights hotel not central shuttle bus service centre yogyakarta plan visit borobudur temple prambanam temple complex able book tour direct tour agencies situate lobby area hotel room good effective air conditioner powerful shower useful request hotel provide dehumidifier humidity yogyakarta get high club facilities adequate good value money enjoy particular freshly squeeze local orange juice cappuccinos staff club courteous friendly special thank lita chabel andreas make span span hellip,0.0,0.632,0.368,0.9847
stay hyatt regency yogyakarta nights delightful experience hotel locate minutes airport without traffic book club room hence check handle club lounge desk upon check guests provide cold wet hand towel refresh drink room good size one view garden golf course spacious bathroom bathtub shower standard amenities provide room include plenty bottle water hotel kemangi bistro main restaurant site limit fantastic menu try local well western dish please quality food food take minutes arrive span span hellip,0.0,0.796,0.204,0.9509
relax stay hyatt one night wish stay nights area instead stay near borobudur ground lovely spend time relax outside beautiful view mt merapi next peaceful koi pond stay one executive club room enjoy breakfast even cocktails appetizers lounge totally worth extra money us room nice size quiet bed comfy like separate shower tub bathroom love food restaurant felt reasonably price saturday night rainy season take advantage watch ramayana ballet performance outside span span hellip,0.013,0.619,0.368,0.9872
good hotel love pool great hotel activities golf tennis etc awesome great would definitely go flaw though food cold especially buffet bed hard everything else absolutely exceptional ever go yogyakarta go hyatt regency,0.033,0.522,0.444,0.9699
jasmine leis lovely welcome touch arrival standard room excellent rate comfortable bed wifi room work well ratna reception helpful arrange cake flower celebration rd wed anniversary beautiful present restaurant ana waitress restaurant attentive friendly really enjoy food reasonably price hotel set beautifully landscape ground wonderful swim pool chinese new year could still find quiet part swim golf course also price good rate free shuttle malioboro town take mins span span hellip,0.0,0.575,0.425,0.9917
husband stay hotel valentine day take standard room garden view love view room wide glass view large beautiful garden room everything bathroom bath tub hair dryer wide lcd etc bed comfortable breakfast various menu eastern western staff friendly helpful could choose breakfast indoor outdoor great view pool atmosphere soothe well worth price surely back hotel,0.0,0.593,0.407,0.9833
astonish reasonable rat hotel season location kilometres north main city area benefit proper resort without traffic noise problems ground beautiful could see golf course also look pretty good restaurant arrange car driver problem service great room fairly average pleasant view garden negative side quite lot noise slam doors corridor early morning presumably people could go play golf admittedly free wifi troublesome necessary keep reconnecting drain combine shower span span hellip,0.128,0.582,0.29,0.9412
soon get vehicle meet hotel driver greet fragrant jasmine leis check breeze since spg members special desk spg members tell could eat breakfast soon rest go ahead check room get quick breakfast safe room not work call staff engineer department come right away replace safe initial contact person yayon helpful friendly pleasant make arrangements us go borobudur temple within hour arrival driver speak little english careful driver first even treat elaborate welcome cocktail span span hellip,0.0,0.709,0.291,0.9754
surprise whenc chcking hyatt yogyakarta beautifully lanscaped imporatntly golfer golf course back yard room not big clean neat breakfast range indonesian western continental breakfast definetley come back stay play golf future,0.122,0.668,0.211,0.5365
overall experience stay nights hotel good however give quot average quot score regardless good service expect perform better reflect star status hotel hotel grind superb suitable look tranquil hideaway busy city yogyakarta yet still reach city center min drive first night great however little disappoint second day find use amenities room not replace supply new one whenever stay star hotels always replace put new supply amenities second third whatever next nights guest stay run span span hellip,0.027,0.762,0.212,0.9412
really enjoy hyatt hotel hotel hotel ground beautiful room comfortable clean nice bed room beautiful view garden welcome hotel two beautiful charm ladies nice smell flower felt special breakfast dinner really good food quality service service waitress gracious beautiful best ever get years plus travel one biggest assets hotel employees strongly recommend hotel,0.0,0.383,0.617,0.9949
come noisy busy city yogua get rid crowd n able sit back fully relax nice hotel many big small swim pool outside hotel adults family kit enjoyable breakfast impresive dinner hotel restaurant note excellent cuisine tour famous borobudur temple prambana temple parangtiritis beach spa hotel recommend advance book require last not lease staff helpful friendly,0.059,0.671,0.271,0.9386
stay nights property really enjoy hotel ground beautiful room bite wear still comfortable clean nice bed breakfast lunch hotel everything really good service quality price best hotel staff everyone nice friendly also provide shuttle malioboro street come handy flight early morning request breakfast box friends also try spa love overall great property great city,0.0,0.476,0.524,0.9928
nice hotel vast amount greenery hole golf course close really good quot warung pecel quot indonesian salad room quite big nice expect star hotel include service,0.0,0.723,0.277,0.8313
good experience stay hotel charm staff guide check area good ambience sourrounding hotel room big window see beautiful view breakfast also good many varieties meet traditional culture jogja touch modernization,0.0,0.62,0.38,0.936
beautiful hotel magnificent ground multiple pool water slide surround garden beautifully design keep ancient ruin borobudur quot theme staff friendly helpful buffet breakfast great combination local fare western favorites free andong rid excellent massage ramayana performances add charm great hotel exceptionally good value money would highly recommend hyatt regency yogyakarta,0.044,0.409,0.547,0.9918
second time choose jotel stay yogyakarta feel like heaven room clean fruit table service professional cannot complain personnel definitely try indonesian massage h one never regret sorrounding field something never see long business trip place want breakfast lot variety also shuttle go centre,0.044,0.68,0.277,0.8745
week ago three nights hotel good clean nice location things bathroom without normal shower five star hotel restaurant close p five star hotel,0.0,0.693,0.307,0.8126
recently visit hotel twice might age little remain impress landscape service facilities excellent place visit kid like swim pool breakfast buffet abundant good quality,0.0,0.63,0.37,0.8939
good impression arrive nice entrance friendly team great view golf course good breakfast room simply depress old old old rest hotel nice let remind necessary important feature hotel room not gonna sleep pool lovely grass golf course sleep bedroom take shower bathroom spend minimum day n night room one thing hyatt certainly one last species still charge internet room not recommend,0.065,0.586,0.349,0.9694
well set hotel provide good care guests room clean well appoint good service choice vegetarian spread limit perhaps blemish hotel set inside main road peaceful wide verity activities golf tennis etc available,0.0,0.567,0.433,0.9524
tell hotel bomb ten years ago still nice start show age maintain pretty well soon need complete renovation owners want remain deluxe hyatt resort room clean little wear ground around resort gorgeous pool great need little renovation well good hotel use super fancy high end hotel would not hesitate stay price good usd night less complete renovation expect x price,0.039,0.558,0.404,0.98
hyatt regency yogja doesnot hold candle hyatt properties around world need renovation today many facilities non existence reason give quot good quot review staff genuinely helpful property beautiful open lush lawns water feature borobudur inspire architect positives beautiful property genuinely affectionate staff extremely helpful give complimentary cake birthday husband organise also shower beautiful bouquets flower card husband not organise say take credit anyways great set ramayana ballet free wifi not positive span span hellip,0.028,0.565,0.408,0.9909
however great stay mum sister nights new year holiday indeed good hotel great facilities swim pool pond jog track andong horse cart tour outbound activities family etc fun swim sunbathe pool must say service great first give us info book andong village tour ask say go directly ball desk wait tell need book tour give hour wanna andong tour room number second breakfast buffet feel lack staff holiday season almost get fight get nasi span span hellip,0.048,0.692,0.26,0.9665
recently visit jogjakarta see sit stay hyatt regency nice hotel good facilities nice pool area green open space golf course however service poor staff whilst friendly slow inattentive restaurants potential food tasty almost every meal eat arrive cold pay club room give access club lounge definitely good option staff club lounge ineffectual issue raise club room nice access ground breakfast good generally decent option within jogja management need seriously look staff,0.093,0.653,0.254,0.9393
stay hotel consecutive nights hotel nice stay garden golf field wide explore jog track quite distance nice try although build seem not new think build keep well clean memorable stay hotel couple years ago traffic hotel not crowd nowadays traffic increase trap traffic light force us take time reach hotel try swim pool feel difference food also good general vary vegetarian normal breakfast recommend stay hotel,0.029,0.726,0.245,0.9313
pleasure see resort hotel staff step social responsibility support noble cause brest cancer awareness work put forth directors entire staff hyatt organize support two days pink ribbon event extremely touch awareness speeches fashion show fantastic dance completion local children competition kick gm hyatt directors impromptu dane receive lot applause laughter hyatt team raise lot awareness fund worthy cause love women save make live hyatt worth,0.048,0.581,0.371,0.9808
stay hyatt regency yogyakarta many time use vip guests well always satisfaction well often host small medium size high level conferences hotel location design quite breathtaking northern part city superb view mt merapi surround greenery thank hole golf course design inspire famous borobudur buddhist temple rise concentric level small scale easy access centre city minutes main road front hotel grow excellent quot restaurant row quot within hundred meter many new restaurants staff recommend hand recommend ibc family span span hellip,0.0,0.633,0.367,0.9889
stay nights not long enough location relatively far city center get tranquility view minute drive airport guests give fragrant jasmine garland upon arrival walk lobby treat beautiful view mt merapi hotel premise huge golf course swim pool spa separate build conference amp meet room room relatively small compare new hotels furnitures date room clean well maintain bathroom clean nice bed comfortable plenty pillow breakfast fantastic many sumptuous choices local western healthy otherwise great selection span span hellip,0.0,0.635,0.365,0.987
hotel not nice view merapi mountain also large garden golf course choose north side room better directly see merapi mountain breakfast excellent lot choice,0.078,0.702,0.22,0.6449
set stun surround could become really nice hotel spend bite money smartening room restaurants like nice staff great service smile beautiful premise great look garden lush golf course long wind pool quiet surround comfortable bed make great sleep quality not great average quality food breakfast buffet wide spread nothing stand likewise la carte options room bite date tire bathroom furnish need freshen not like location away town nothing interest nearby beautiful pool dirty occasion venture swim patchy wifi connectivity span span hellip,0.046,0.576,0.377,0.9902
stay nights hyatt nice hotel staff friendly helpful restaurant treat royally service superb since vegetarians explain could staff amp chef come tasty options room could little bigger look little wear consider jogja one good properties stay overall good experience stay hotel,0.0,0.614,0.386,0.9657
second time stay hyatt jogja expect everything perfect time enter hotel last minutes kid love pool fish pond cycle golf area take club room free access club area afternoon coctail breakfast dinner serve well wide variety local international menu staff helpfull take care kid well,0.0,0.677,0.323,0.9559
never property yet treat like long time see friend impress flexibility agility handle need property build although property seem old atmosphere spot unfortunate didnt bring family along property great place quality time family foods excellent lagoon pool fit kid also hole golf resort rent golf stick affordable one thing bug internet connectivity come go pay extra get high speed connection overall property great definitely go back,0.075,0.608,0.317,0.97
really like hotel comfortable green hotel touch traditional heritage java facility andong bicycle around hotel food quite good weather beautiful,0.0,0.538,0.462,0.9289
stay nights hyatt yogyakarta company conference hotel big many facilities swim pool fitnes center spa even golf room ok amenities fine staff helpful friendly breakfast good lot varieties however tell hotel show age bedsheet not clean stain bed not comfortable hard water pressure not good hot water sometimes not work stay bathtub old style slippery consider remove bathtub least put mat dangerous almost felt whenever shower hyatt yogyakarta definetely grand past however would not consider visit yogyakarta span span hellip,0.104,0.691,0.204,0.8332
stay hyatt week half originally try make reservation entire week stay actually glad space pros staff extremely nice without doubt best part stay really make feel welcome point feel terrible write negative review manager nur go way sit recommend place visit area members staff also really really nice landscape beautiful look relax oasis loud dirty city definitely feel get hotel room bed really comfortable though hotel fully book many days never span span hellip,0.126,0.578,0.296,0.9486
