hotel beautiful surround lush garden breathtaking view golf course staff friendly helpful hotel beautiful well room standard size not big small buffet amaze amaze view well outdoor seem like different world amidst hustle bustle city outside totally recommend,0.0,0.448,0.552,0.9852
feel like home pleasure stay business trip perfect room size support facilities include hole golf course everyday wonderful stay come next visit family vacation,0.0,0.538,0.462,0.946
stay days wife kid parent day stay kid get sick stay hotel days straight luckily parent end scour every nook cranny hotel enough entertainment inside hotel even stay beautiful room fantastic view awesome service staff wonderful definitely back,0.057,0.497,0.446,0.9709
beautiful hotel many facilities great pool delicious food especially breakfast buffet remote place busy city place look also wonderful night decorations cover light top hotel,0.0,0.538,0.462,0.9531
really like hotel experience hotel provide business trip spacious room could feel comfortable private balcony experience bite quot quality time quot kemangi bistro nice poolside view outdoor part bistro wonderful beautiful tree bar also nice view near golf field would absolutely stay hotel another occasion,0.0,0.669,0.331,0.9601
great complex beautiful swim pool middle nature excellent service provide staff definitely recommend hotel visit yogyakarta drawback distance town take min case traffic min traffic,0.0,0.542,0.458,0.9509
whenever visit indonesia american indonesian wife years plan visit around fabulous hotel resort never treat like place treat address like royalty like family like important couple planet gm right genuinely pleasant extremely accomadating staff one would hard press find better service anywhere favorite place stay throughout us europe uae etc breakfast include everything imaginable traditional indonesian asian middle eastern everything westerner could desire pool see believe along borobudur replica water slide nine hole executive style golf course fun span span hellip,0.141,0.658,0.2,0.842
stay days hyatt chance get upgrade make stay even greater hotel splendid garden astonish well golf course daughter love slide build reproduction indonesian temple buffet breakfast dinners great well people smile great service come back great pleasure,0.0,0.425,0.575,0.9874
hyatt hotel ground breathtaking big wow landscape garden ponds temple structure garden swim pool give calm peaceful meditative feel however feel room date need renovate new furnish upholstery also towel tire old good thing bring towel stay club floor access executive lounge better place eat compare main din area downstairs find kinda dark gloomy servers polite will please not good english moments could not understand disappoint part stay food many offer mostly span span hellip,0.014,0.686,0.3,0.9767
stay beautiful hotel june room good size sleep quality beautiful clean well appoint din area large comfortable seat amp ample choice usp separate menu kid vegetarians though limit break fast lavish stay seventh floor corner room add advantage attach terrace swing pool large different pool nicely connect miss spa amp golf hotel run efficiently care staff beautiful aspect safe well maintain eye soothe landscape garden stupa nicely integrate water body bloom lotuses amp sit deck offer panoramic view restful stay,0.014,0.568,0.418,0.9917
tittle say best hotel ever price almost ridiculous compare service beautiness not luxury hotel fan discoved one quot accident quot look nice place diner special day day check hotel stay come hyatt,0.169,0.605,0.226,0.5316
carpet must original year old carpet tell hotel build look like foot paths need update nice ground small fitness center size walk closet weight machine small build past pool pool nice lobby nice property sit middle poor part city need take car really see anything area food average breakfast buffet not impressive even juicer machine juice staff actually use blender blend fruit veggies strain metal strainer add water plastic jug serve runny runny span span hellip,0.098,0.721,0.182,0.7648
know special place right moment walk door smell check area like take special oasis breakfast incredible last late morning american indonesian options exceptional pool world even feature water slide super fun kid pool swing ground large plenty space walk around shade even sidewalks use stroller highly recommend stop indonesia,0.04,0.673,0.287,0.9373
beautiful landscape classic design complete facilities strategic location amp friendly service place swim pool star hotel resort like design make us forget middle busy city,0.058,0.646,0.295,0.8271
stay june lovely staff incredibly friendly helpful make wish come true breakfast almost much comprehend quality superb ever make back region definitely stay come back hyatt,0.0,0.456,0.544,0.9708
july stay hyatt regency yogyakarta saturday hyatt regency locate north side yogyakarta near kaliurang quite far downtown hotel nice full plant love green hotel hotel also big big swim pool water slide also golf field ok weekend must great arrive around pm get uppset need hour check wait hours get room ft floor room nice warm get coconuts view lucky get mount merapi view golf view room quite old yaa maybe like old hotel swim pool nice design like waterboom every saturday night day hold ramayana night market eat indonesian food banquet ramayana dance perform span span hellip,0.0,0.755,0.245,0.979
one better place stay service superb greet door fresh jasmine necklace wear day one nicest touch always remind indonesia let check early late checkout architecture western menu club hyatt western interest get authentic fresh slice challah middle java good changeup day ground great not much one hotel pool swim try one pool water slide lot fun pool wrap around extensive could spend hour walk around outside ground without even step golf course span span hellip,0.0,0.681,0.319,0.9825
stay days room breakfast really good great pool friendly staff good service location not close center good hotel family well interest show every weekend traditional food music exactly stay come back yogyakarta,0.0,0.529,0.471,0.9693
wife two kid amp stay room excellent facilities brilliant pool expansive ground good base explore yogyakarta great food restaurant particular local dish give buffet able try lot different javanese dish especially desserts tour operator conveniently locate within hotel organize couple trip include mount merapi trek yo son definitely stay next time,0.0,0.728,0.272,0.9531
member hyatt family disappoint wonderful service great f amp b options extremely lush pool surround jog track round hotel nice touch room well equip cosy whole brilliant experience extremely value money would suggest top choice look luxury yogyakarata little bite away hustle bustle city centre shuttle trip city centre provide free must book advance,0.039,0.614,0.347,0.9665
five star hotel private golf course stay play golf well staff helpful even though slow response ask help breakfast menu complete,0.0,0.63,0.37,0.8402
stay one night give us enough impression write rewiev greet big smile jasmine petal chain around neck refresh cocktail soon leave smile none hold doors open handle lagguage arrive feel like pay number really disappoint feel additionally argument taxi service call quot golden bird quot make price package totally make sense first want see prambanan temple go magelang stay hotel charge us rm hours change plan feel poorly due headache skipp span span hellip,0.095,0.738,0.167,0.6378
hotel nice atmosphere grind rate star hotel hyatt standards staff nice really understand want expect hotel stay nice not one would come expect chain top end,0.0,0.641,0.359,0.8683
wife stay hyatt regency one week welcome amaze hospitality friendship concierge mas rudy team mrs dharmayanti fo team kenan fitra manggala mbak sri mas ery colleagues housekeep staff clean room clean mr kasno last not least hard work leadership pak nurchayadi gm support pak renzo f amp b director pak joko director engineer make one week stay hyatt regency like home amaze friendly profesional staff attend standard room big clean selection buffet breakfast good attend wed niece hyatt ballroom pak renzo chef span span hellip,0.012,0.679,0.309,0.9835
hyatt yogyakarta marvel borobudur shape hotel beautiful staff wonderful view merapi volcano superb book regency club package smart idea club access allow comfortable stay fuzz monetize package benefit proof equally expensive book standard room plus breakfast din,0.0,0.533,0.467,0.9761
love hotel quite room stay large enough clean traditional bed extra like homy great bathroom bathtub nice take bath long warm water pool happy swim children lovely children want go back next visit hotel large yard explore green garden traditional temple see around bicycle dinner bbq breakfast ready delicious taste,0.0,0.54,0.46,0.9851
awesome banquest team service polite attitude client run event ballroom really appreciate place recommend bussiness conference internal meet,0.0,0.603,0.397,0.8707
superb hotel delicious kitchen excellent spa friendly personnel room large clena perfect bathroom downsides nice bar empty satvthere aline wauters swim pool not clean proces wine high,0.092,0.429,0.479,0.9592
stay hyatt regency yogyakarta days nights family love swim pool especially slide children hotel beautiful landscape number children activities impress staff attitude smile greet ever restaurant hallway lobby pool personally thankyou help mr denny hidayat director sales arrange transportation mother unable walk far due old age hip operation go restaurant outside hotel complex really happy choose stay family holiday thankyou keep,0.0,0.649,0.351,0.9766
spend time bali jakarta yogyakarta final leg journey family four usually stay five star accommodation think indulge week first glance hotel impressive ground front lobby restaurant however soon bring back earth show room extra rollaway bed year old king bed wife year old share little room move bathroom also small tire sure could book extra room girls would double price stay justify natural compare accommodation come spacious bedroom apartment central span span hellip,0.0,0.856,0.144,0.8555
experience hyatt hotel memorable like yogyakarta hyatt balsam place really enjoy phenomenal environment spectacular swim pool golf tennis court paths walk room lovely best thing service kindness truly interest help visitor us remarkable fact hyatt problem taxi help solve bear mind country speak language solve problem specially disturb delicious,0.101,0.411,0.488,0.9836
stay hyatt regency n hotel excellent young family horse cart fish pool huge pool kid entertain ground beautiful service excellent restaurant kemangi great place explore local cuisine ramayana night sit excellent catch ballet ramayana comfortable set esp young toddler hotel relative central location visit borobodur prambanan temple,0.0,0.585,0.415,0.9799
hotel set gorgeous especially entrance garden room bite disappoint see beautiful common areas room seem bite outdated not match quality rest hotel locate outside town centre not ideal shuttle limit space available staff helpful place great relax trip enjoy pool spa food good centre explore everything yogyakarta offer,0.08,0.571,0.349,0.9603
beautiful hotel amids wonderfull lush green garden room bite date facilities easily compensate garden pool amaze breakfast real feast would not hesitate go back oasis rest centre jogja,0.0,0.674,0.326,0.8913
especially enjoy restaurant price fantastic lot choose breakfast buffett amaze staff super friendly speak english beautiful ground nice clean room locate bite town taxis always available,0.0,0.399,0.601,0.98
stay nights th july amaze hotel tremandous service surprise experience survice altogether lobby reception concious restaurant realy appreciatable great amusement guest take horse cart ride ramayana night market amp malioboro tour blue bird car service also nice good quality english speak driver swim pool area awesome spa good not outstanding golf grind terrificly beautiful hotel lavish interior amp architectural design decoration everything guest desire altogether highly recommend hotel yogyakarta,0.034,0.592,0.374,0.9837
hotel hyatt regency yogyakarta choice travellers yogyakarta business travellers tourists hotel large set extensive beautiful garden compliment excellent pool golf course great restaurant bar well wonderful spa professional business facilities room large well appoint comfortable cleanliness hotel priority clever welcome staff whilst ground room feature hotel outstanding staff make stay special warmth professionalism display staff throughout long stay impressive thoughtful diligent charm high level train professionalism appreciate span span hellip,0.0,0.5,0.5,0.9943
hold meet hotel follow couple days r amp r large property expansive pool spa golf course albeit small side accord g golfer group quite decent especially early morning staff helpful meet well individual level room open yard golf course pleasant customary amenities breakfast buffet wonderful taste orient local european real coconut milk bear resemblance one available supermarkets western world pool sprawl different level particularly suitable kid occasion especially business trip span span hellip,0.0,0.847,0.153,0.8979
location hotel not quite heart city great weekend get away not need get anywhere else relax weekend pool great food drink offer delicious hotel children friendly staff friendly,0.0,0.503,0.497,0.971
arrival greet flower necklace check lovely lady show us wait area provide refreshments sign key inside deluxe room await wonderful balcony terrace overlook golf course room spotless room service fantastic food even get start one week trip jakarta bistro best food far eat every night good knock hyatt one certainly impressive stop read book,0.03,0.596,0.374,0.9761
hyatt regency yogyakarta nice ground many activities children friendly within near distance best restaurants town staff friendly helpful free andong rid also provide hotel guests however room especially bathrooms old bite unclean standard two room problems wifi network signal almost non existent also make order room service problematic us order online instead pick phone overall room overprice get major renovations seem necessary uplift beautiful property previous splendour befit prestigious name,0.061,0.651,0.289,0.9682
stay night st floor great garden great pool children love great staff good price various choice breakfast room bite moldy smell overall still great stay still recommend,0.0,0.435,0.565,0.9799
stay nights group room holiday mix feel hotel establish second half nineties entrance nice big banyan tree give ambiance old java lobby clean aspected brand staff friendly helpfull room old dull bathroom long time due total refurbishment lot mark dirty black spot anti skid mat bath tube not expect big hotel chain day two staff forget provide bottle water day three not provide towel extra bed solve call service breakfast excellent lack service due high season not happen landscape show old need care span span hellip,0.114,0.687,0.199,0.8442
look relax venue lush garden amaze swim pool place stay hyatt regency situate outskirts jogja minutes away city center location convenient wish visit borobudur hotel resort feature tennis court landscape golf course view mount merapi pleasant din areas moment receive jasmine garland check drive two days later assist well train service orient friendly staff go extra mile make stay enjoyable room spacious clean quiet comfortable lot amenities breakfast superb myriad choices eat table place span span hellip,0.0,0.686,0.314,0.9829
really big hotel green surround especially kid love fish ponds breakfast vary great choices big city hotel staff lack smile local travelers,0.073,0.574,0.353,0.8683
yogyakarta well hyatt yogyakarta make feel want come back already many time time manage surprise new feature staff attentive friendly well mannered will assist outdoor lobby terrace view mount merapi priceless,0.0,0.678,0.322,0.836
love hotel big swim pool big slide kid favorite part hotel want get swim pool love rid bike around golf course tennis court get nice view mount merapi room breakfast lovely staff amaze andong ride free around hotel guest plus hotel wait go back,0.0,0.58,0.42,0.9779
hotel outside yogjakarta hr taxi also way borobudor side kraton palace staff friendly helpful breakfast amaze continental local fruit smoothies everything swim pool good also children slide even entertainment room good spacious,0.0,0.59,0.41,0.9524
family love hotel kid really enjoy pool want leave place breakfast great lot selection also serve local foods jamu healthy herb drink java hotel super big kid keep busy whole day location bite far city taxi cheap jogja pretty small avoid peak season lebaran day june december time jogja pack domestic tourist traffic crazy love hyatt try bandung jogja nusa dua bali great,0.066,0.578,0.356,0.9811
hotel offer lot greenery beautiful landscape good place stay family although locate outskirt take around minutes city center room bite small compensate view breakfast good lot food choice,0.0,0.72,0.28,0.8658
garden golf view nice air fresh location close city food good staff good helpful outside area hotel golf area good jog family gather,0.0,0.506,0.494,0.9393
resort expansive beautiful room however need renovation outdated not well keep go washroom overall beautiful place yogayakarta get direct view volcanic mountain also run direct shuttle market helpful,0.05,0.659,0.291,0.8685
many hyatts welcome service really impressive friendly personal resort style hotel lot amenities like room bite outdated fair hotel staff make really great place stay,0.0,0.497,0.503,0.9599
hyatt indonesia well american hotels country well make quite glamorous time come go indonesia past years american hotels never disappoint like many international hotels place complex security wall almost standard many part indo hotel ground stun pool build show similarity prambanan borobudur give exotic feel also beautiful golf course see outside lobby service like many american hotels indo amaze give free massage wait checkin flower lei give arrive issue think room bite date old clean nonetheless span span hellip,0.043,0.682,0.275,0.9671
jogja hyatt regency best hotel love ground pool housekeep wulan wonderful regency club kemangi bistro hotel model borobudur yogyakarta home largest buddhist temple world view merapi spectacular hotel not find better hotel jogja,0.055,0.667,0.278,0.8932
love step whole different environment moment enter hotel lot greenery around golf course build well love design hotel also organize cycle tour enjoy food reasonable would suggest eat,0.0,0.637,0.363,0.9287
stay nights hotel lovely staff friendly garden beautiful relax hotel well place visit borobudur hour prambanan mins mins city centre malioboro street depend traffic hotel quiet green swim pool lovely km walk jog track room nothing fancy clean well appoint travel desk great reactive organise things day us surprise actually prefer hotel previous one stay dec restaurants within walk distance,0.028,0.623,0.349,0.977
nice hotel friendly staff good food perfect breakfast buffet indoor outdoor huge poolarea golf course give quot five star quot although hotel could need renovation two watertubs hot cold water shower curtain bathroom not equipment expect also poolarea great visible modern tile need would area would make reservation hotel,0.0,0.694,0.306,0.9584
hyatt like expect hyatt not new great staff friendly atmosphere like expect star hotel room nice actually bite old bathroom could need small renovation cleanliness good could bite better maintain another point look funny every light room another color guess not part design f amp b expect sadly serve high tea afternoon pool park golf course amaze spa great staff amaze treatment perfect polite train please forget tip staff basic sellary low overall enjoy stay come back,0.125,0.541,0.335,0.9702
make feel like kings queen perfect whole family love pool feel like theme park breakfast fabulous room clean staff hospitable without intrusive relax,0.064,0.428,0.508,0.9485
need pay bite much totally worth totally service food facilities everything literally good however bite far go place like malioboro tugu jogja prawirotaman hotel still one favs far,0.042,0.727,0.23,0.7346
stay nights hotel beautiful situate way well integrate lush garden koi ponds around hotel staff friendly helpful room clean comfortable little balcony table two chair nice little bonus favorite place spend time pool huge surround plant tree give tropical jungle feel breakfast buffet well worth additional charge everything could possibly want thing bring rat star rat last night decide eat hotel restaurant however go surprise event go span span hellip,0.0,0.606,0.394,0.9854
great staff especiall ymr budi take great care us make family holiday worthwhile food superb especially breakfast buffet great location amaze hospitality visit,0.0,0.347,0.653,0.9821
th th time stay hotel far nothing change still best favourite hotel yogya location not really city centre bite far major tourist spot malioboro street sultan palace bringhardjo market etc need take taxi car reach place make quiet peaceful golf course next hotel favourite spot hotel outdoor lounge enjoy view golf course amaze merapi mountain especially morning room nice huge clean well maintain good amenities something expect hyatt standard service amp facilities nice pool favourite far huge pool area cover tree relax restaurant span span hellip,0.031,0.672,0.297,0.9775
sure expect hotel price cheap expect much amaze moment walk entrance lobby wow beauty hotel room reasonable size comfortable multi level pool superb lush garden overhanding tree around bridge water slide wonderful,0.0,0.484,0.516,0.9766
hotel place nothern yogyakarta great view merapi mt great place take rest family hyatt yogyakarta seem build want escape crowd want escape routine activities place perfect food really fit indonesian tounge really good foreigners,0.0,0.511,0.489,0.9678
stay two nights enjoy see borobudur temple prambanan temple others also beautiful landscape hotel staff friendly professional attitude well train felt hotel basic concept market wonder city business hotel resort hotel,0.0,0.685,0.315,0.9081
regulary visit hotel sunday brunch house staff always nice helpful beautiful huge garden nice golf jog track also good place family activity always nice stay resort hotel surely come back,0.0,0.487,0.513,0.969
first time jogjakarta hotel n checkin efficiently do greet happy smile face welcome drink serve touch warm hospitality garland jasmine flower place around neck surprise mins massage give sure comfort travel quite awhile room spacious quiet clean white sheet sleep spotless white towel provide sleep quality excellent pin drop silence good night sleep breakfast wide array dish local western location minutes drive away shop area free shuttle service provide guests however one need prior reservation reception span span hellip,0.021,0.629,0.35,0.9842
face worst service ramadhan month hotel mostly valid people not fast food beverage serve fully people not take fast totally disappoint,0.272,0.728,0.0,-0.796
staff beyond friendly polite well verse english check process breeze welcome drink short massage service sublime help settle alot things us stay hotel ground room clean gem jogga indeed ask,0.0,0.646,0.354,0.9136
family four stay hyatt june give us adjoin room request find room clean good condition not sure many complaints room maintenance staff kind friendly helpful garden simply beautiful daughter enjoy one whole day activities staff really know make kid happy fish art class game pm thank daughter love activities much absolutely refuse go town tour stop talk catch fish morning another afternoon andung horse carriage ride also quite novelty children breakfast also good span span hellip,0.063,0.579,0.358,0.9849
first sight hotel landscape simply beautiful view mount merapi lobby however days notice quot crack quot kid use water slide quite lot son get hurt paint chip come slide one bedside light blow leave room complete darkness fix minutes notice wire tap shower tap hard turn amp safe work arrive fix day pancake amp waffle station go bust well one morning manager apologetic manage get fix hotel need bite love amp attention make room otherwise fantastic manage relax span span hellip,0.081,0.709,0.21,0.9287
discrimination staff look judge customer look hotel good view nice food nice please train staff use shirt cant stay hyatt,0.0,0.597,0.403,0.8689
overall happy hotel enjoy stay would nicer room not far walk noise room us good spread choices food breakfast bill quite confuse,0.069,0.533,0.398,0.8887
nice excellences ambiances green quiet nice swim pool perfect place short golf game close proximity kaliurang merapi recreations destinations nice restaurants available near hotels,0.0,0.549,0.451,0.9393
love hyatt treat us really enjoy spa son enjoy pool fish bcycling turtle feed husband really enjoy ambience banyak yang bisa di lakukan disini jalan pagi pun menyenangkan rasanya hampir semua yang ada di jogja terwakili disini breakfast dinner feel great,0.0,0.62,0.38,0.9701
great hotel great lanscape pool kid happy slide pool fish pond friendly staff need improve check process hotel provide free andong overall ok come,0.0,0.42,0.58,0.9735
good part luv resort beautiful golf course garden pool overall outdoor layouts breakfast brunch amaze indonesian food place improvement room layout could little better seem outdated perhaps may adopt ethnic style overall visit jogja definitely come resort,0.0,0.596,0.404,0.9602
hotel nice set among quite seclude ground large swim pool downside hotel distance away city center run shuttle bus hotel city center every hours yogja traffic nightmare get sight city take long time,0.056,0.866,0.078,0.2023
