hotel proper hygiene protect covid staff trainee friendly great taste breakfast delicious rice bowl bed comfortable comfy service team members excellent especially restaurant pool angkringan joyful,0.0,0.437,0.563,0.9764
go whole family vacation yogyakarta many hotels choose decide stay hyatt regency location initially experience get expect especially facilities,0.0,1.0,0.0,0.0
decide stay know interior date need renovation still like stay future hotel good staff one best outdoor facility city,0.0,0.625,0.375,0.8625
good view nice swim pool area walk jog track enjoy cool air among tree good traditional food like getuk nice staff good service find peace hyatt jogja back visit jogja see soon,0.0,0.471,0.529,0.9744
hotel nice especially outdoor facilities like jog track bike rental swim pool enjoy beautiful view well manage garden golf course merapi mountain background,0.0,0.549,0.451,0.9295
best service hotel staff nice escort front desk door room detail explanation facilities comfort cleanliness guarantee pandemic,0.0,0.531,0.469,0.8885
service hyatt regency good hotel also good especially large swim pool golf court offer upgrade club house get good complimentary quite worthed like enjoy cocktails afternoon overall service hotel good especially restaurant,0.0,0.547,0.453,0.9625
experience stay hotel hyatt jogja pleasant moment atmosphere comfortable close city yogyakarta large green space golf course swim pool love cycle morning around green route get fresh air oxygen lush green view,0.0,0.681,0.319,0.9201
wonderful stay hyatt yogyakarta make days beautiful surround include golf view beautiful huge pool tennis court grab wheel kid enjoy facilities favorite tarzan rope pool back,0.0,0.5,0.5,0.9638
room get date facilities great guest recovery service not good not receive anything except apology keycard program wrongly twice besides front desk department service great,0.073,0.64,0.287,0.7902
many activities kid vacation interest bicycle rid mini golf swim pool hot stone lobster good room hotel little bite old maintenance good thank hospitality,0.0,0.639,0.361,0.8834
stay hotel visit yogya reason daughter love swim pool swim pool large long slide balcony nice view also ride bicyle scooter jog track,0.0,0.75,0.25,0.7906
big outdoor area various family activities perfect bring family new normal era children love pool game activity rental schooter also bike free use hours,0.0,0.652,0.348,0.9042
complaint hotel facilities surround huge green garden offer activities restaurants good food try bogey kemangi staff helpful responsive room ammenities complete star rat due old condition room need major upgrade room phone break tv remote break well sofa see better days bed still okay pillow lumpy furnitures wear mind stay deluxe room maybe higher room class condition better,0.031,0.685,0.284,0.9442
clean satysfy thx u kindly staff make family happy helpful mybe next request choice type room not available thankyouu breakfast many menu local food,0.0,0.547,0.453,0.9313
check tell room upgrade especially guest several experience stay hyatt jogja hotel distribute free hand sanitizers mask guests staff friendly helpful room instal sanitary stickers food drink breakfast quite vary food drink order room also taste ok facilities complete wide landscape great view golf course playground grab wheel swim pool etc suitable family vacation children generally satisfy stay hyatt,0.0,0.705,0.295,0.9674
staff kind friedly always smile helpful check process take long time minutes wait minutes room would not ready,0.085,0.564,0.351,0.7643
overall meet expectation althought pandemic moment still actitfities public area without worry hyatt run covid protocol example breakfast time selfservice servered,0.0,0.893,0.107,0.3412
overall service cleanliness room etc good bad experience housekeep staff room clean not give new slippers room time ask new slippers wait almost hour,0.116,0.698,0.186,0.2732
definitely back soon everything good hotel family friendly large pool large garden room clean amenities complete even provide iron board room,0.0,0.596,0.404,0.8885
good health protocol covid pandemic make feel safe stay nice spend time family clean tidy friendly staff recommend thank,0.0,0.381,0.619,0.9552
room old swim pool slippery need clean gym sauna old look dirty hotel host weddings dog show stay would appreciate warn guests would host big events covid period,0.128,0.712,0.16,0.2732
staff friendly helpfull really love view bathroom enjoy stay sisters bridal shower room fun ask lot help telephone receptionist answer well,0.0,0.441,0.559,0.9583
great hotel nice environment view mount merapi lobby service excellent ease check check food good many activities join include cycle morning,0.0,0.42,0.58,0.9538
staff room ambience foods everything great hyatt give best stay experience crazy time really enjoy stay certainly come back stay hyatt regency come jogja,0.067,0.53,0.403,0.9195
hotel like picture breathtaking view landscape hotel look old still well maintain everything function perfectly bed pillow comfortable even extra bed good sleep really enjoy facilities especially swim pool staff nice breakfast delicious eventhough quite surprise varieties not much regular buffet understand maybe covid time try manage simple breakfast still health protocols way one thing quite dissapointed find glass room still dirty coffee stain still overall great experience stay go back sure span span hellip,0.029,0.61,0.362,0.986
beautiful view complete golf course perfect honeymoon staff really care need especially trainee name reza help lot also staff give us beautiful flower arrangments surprise gift check,0.0,0.468,0.532,0.9709
excellent service clean room also already comply health protocol respect covid protocol absolutely enjoy also like location hotel overall excellent,0.0,0.418,0.582,0.961
star little generous amaze staff nice pool decent food save review hotel room outdated somewhat musty ask staff say years since renovate show thing worse room fitness center really small room dingy carpet two older treadmills outdated weight,0.063,0.647,0.29,0.8815
stay hotel daughters take room regency club unfortunately hot water not good seem need improve bed need change quiet old guess bed linen well enjoy breakfast overall menu good,0.188,0.599,0.213,0.2472
great big hotel middle city condition hotel quite old good maintenance care family experience good staycation good environment big green environment around hotel,0.0,0.517,0.483,0.9504
come intimate wed party stay night family love room foodis delicious everyone kind helpful would love come another occasion thankyou,0.0,0.4,0.6,0.9682
expect much facilities hyatt regency sastifying us hope stay hyatt soon enjoy swim pool rid bicycle also enjoy vibes room,0.0,0.646,0.354,0.8519
good experience quot staycation quot pandemic era hospitality overall service maintain best quality approach warm welcome kid family friendly lot laughter happiness many thank hyatt regency yogya back,0.0,0.449,0.551,0.9735
perfect choice want enjoy stay beautiful hotel nature surround enjoy nights stay whole family baby kid staff friendly helpful accomodate need swim pool awesome definitely come back,0.0,0.39,0.61,0.9801
almost weeks oct oct stay hyatt regency love hotel food set menu surprise indonesian taste love hotel facilities golf course swim pool jog track gym bike mini bar,0.0,0.704,0.296,0.8885
actually not first time stay satisfy always nice helpful staff beautiful view old build hotel service gold worth stay vacation thank,0.0,0.47,0.53,0.9423
hotel family friendly peaceful athmosphere pool best choose outdoor area breakfast sensation breakfast tree poolside however provide limit menu variance breakfast menu stay days also find closet room clog also need ask doormat bathroom provide first day stay,0.0,0.768,0.232,0.891
hotel facilities really excellent food offer convenient appropriate western travellers want variations beyond delicious indonesia food hole golf course surround hotel pool absolutely beautiful many nice corner provide alternatives sun shade group friends isolate,0.037,0.561,0.402,0.9555
nice make happy moms beautiful place take rest fun yogya swim relax hot pool become good memory quality time moms sisters,0.0,0.435,0.565,0.9612
love room good breakfast nice facilities great view staff friendly amp warm unfortunately due low occupancy pandemic limit hot water shower understand safe opex,0.108,0.361,0.53,0.9552
largest hotel yogyakarta open space lot door activites golf jog feed fish play turtle fish lot great experience strict health protocol keep us safe come future,0.0,0.71,0.29,0.8555
ithe hotel large area include golf field back landscape green full tree garden pool complete facilities suitable family kid business meet leisure love surely come back,0.0,0.772,0.228,0.7964
hotel close several decent eateries ikan bakar cianjur nasi uduk palagan iga sapi bali hotel side side golf court despite nearby palagan rather crowd bustle feel like different seclude peaceful region great huge swim pool gym available hours fish pond along many facilities since visit pandemic upon enter premise temperature scan compulsory hand wash sanitizer available provide scuba face mask pocket size hand sanitizer upon check hotel claim frequently touch surface hotel premise sanitize hourly room seem sanitize seal door prior check hotel build age well span span hellip,0.0,0.799,0.201,0.9618
love relax ambiance excite experience well friendly staff amenities also become highlight trip hyatt already provide everything need one magic box even though room interior still feel classy old not affect sleep quality first time stay hyatt would love come someday,0.0,0.569,0.431,0.975
staff friendly helpful best place staycation hotel big swim pooln garden big ambience good facilities like jog track bicycle golf pretty good try,0.0,0.424,0.576,0.967
wonderful experience wth family also son really love pool next vacation really put hotel priority plan u want taste food suggest banana flitter nasi goreng kampoeng,0.1,0.62,0.28,0.7264
really enjoy stay hectare hotel hospitality impressive staff friendly helpful breakfast serve various quality items get bore request simple dish wonton soup fry noodle etc room package include rice bowl dinner kinds rice bowl menu choose delicious years operation hotel need remodel indeed still everything still run well clean around hotel area place extremely recommend,0.028,0.638,0.334,0.9686
spend birthday trip year staycation hotel actually want enjoy ramayana ballet dinner afternoon tea facilities not open due covid best thing staff make nasi tumpeng birthday really touch,0.0,0.742,0.258,0.8271
want say excellent place not new build maintenance resort keep good condition hectares land not enough stay one night explore resort feel like whatever want thats food presentation breakfast complete delicious specially come summer session weather indonesia really recommend staff warm helpful lot activities hotel bike fish also play golf resort,0.0,0.616,0.384,0.9704
memorable experience stay days clean hotel friendly staff food everything ok special thank front office staff duhita lovas cant wait stay see u soon,0.0,0.575,0.425,0.9062
obviously experience hyatt skewd due circumstances stay fabulous nonetheless plan two weeks indonesia bali sumba yogyakarta last week quot jogya quot hyatt not anticipate impact pandemic covid dismay park museums particular hindu temple close due virus fortunately us hotel not close although one guests week wait staff superb every way intense precautions take sanitize everything make us feel comfortable safe exercise quot social distance quot still manage enjoy lounge restaurant spa pool hotel even upgrade room place us span span hellip,0.029,0.779,0.192,0.9371
pleasure stay excellent service arrival departure would like say big thank make birthday stay huge success possible without guy popy acong team professional friendly halpful great job guest room clean quiet beautiful amenities may need bed king size comportable sleep beautiful cake arrive great hotel restaurant great buffet breakfast special thank pak rendi explain anything good jamu helath thanky much hospitality great time hope stay longer next time good luck guy simply rock,0.0,0.448,0.552,0.9964
love love love everything hotel friendly gesture staff service available feel like javanese royal hotel impressive indoor decor outdoor landscape get room decor room slightly underwhelming grand get room good not good enough grand hotel like hyatt regency didnt dampen experience make use facilities available jacuzzi sauna cold whirlpool swim pool andhong tour around gold course amaze breakfast know also offer free shuttle malioboro wouldve useful since run rupiahs last day city span span hellip,0.0,0.575,0.425,0.9923
great hotel group book want fantastic time great ambiance throughout ground koi size ofsubmarines temple double slide pool staff great attentive quick breakfast great amaze dish crust snapper especially series pool allow space kid play adults doze downsides city centre traffic take get accidents happen slide automatic light system safe slide stone man crash back neck speed not part holiday,0.084,0.543,0.373,0.9776
amaze sincere service ever experience hotel local indonesian hotels tend put special service towards foreigners not hotel top notch service right check check facilities impeccable hotel quite old well maintain free andong yogyakarta horse carriage ride around hotel facilities free shuttle service malioboro great pool nice rooftop view many facilities experience breakfast awesome always get refill need mention ms christine give us warm welcome upon check mr sugeng one chefs ask whether food nice chat like friends long time staff general span span hellip,0.014,0.612,0.374,0.9903
im stay hyatt today night room first impression hyatt real star hotel serve excellent upon check ms christine explain us facilities help us check process also suggest us take picture together escort us room woow excellent service enter room really touch honeymoon set get actually request month ago note well love muchh give us fresh red rise slice cake free explore facilities come club lounge swim pool swim pool love take picture swim pool staff name adam greet talk friendly guy like span span hellip,0.0,0.669,0.331,0.9873
celebrate anniversary hyatt regency yogyakarta thankful staff friendly especially front office team beyond expectation nothing better go home family eat good food relax thank lot,0.061,0.458,0.481,0.9476
nice place stay town long time excite opportunity family happy swim fish massage table tennis golf run jog many,0.0,0.547,0.453,0.9081
worth stay hyatt regency enjoy garden pool food soo tasty yummy staff nice helpful really memorable experience baby husband look forward stay,0.0,0.547,0.453,0.9201
go hyatt work break could not happier probably best purchase still early good service top notch everyone friendly helpful though go extra mile cliche certainly real get hyatt view sublime facilities plenty food fantastic could not find fault hotel aside maybe kind older room design pretty raggedy bath robe definitely come back,0.083,0.538,0.38,0.9644
hotel highly recommend leisure purpose nice cozy peaceful whole family golfer hotel also provide hobby bring children years enjoy,0.0,0.556,0.444,0.8999
exceptional facilities good location clean beautiful territory helpful nice staff nice place yoga meditation massage great place rest children big territory many facilities,0.0,0.421,0.579,0.9682
exceptionnal location service natural green area best yogyakarta compare opinion awesome staff attentive efficient high level food large choice javanese international meals drink great experience,0.0,0.531,0.469,0.9565
return year year venue happy return year march favourite hotel travel world im bring colleagues time march excite staff quality hotel second none,0.0,0.755,0.245,0.7783
stay many time since year son years old resort hotel never fail son want stay hotel whenever jogjakarta everything always good mostly like pool area km jog track amaze breakfast buffet room overlook greenery comfortable bed mostly love staff genuinely polite always greet name always attentive specially anna breakfast area sugeng kitchen make delicious nasi goreng kecombrang cook ala minute special breakfast,0.015,0.641,0.344,0.9793
please consider late check request justify within allowable hotel rule request late check recent stay hotel reject receptionist clear reason,0.11,0.691,0.199,0.296
stay cousin wed room not ready yet arrive come check time love welcome gesture one apprentice also help check exterior indeed nice remind bali come back lunch outside could go room saw lady reception hold cousin wed booklet didnt give key think book later room really simple room not much interior soo noisy project go leave n right room beside mine top mine room like surround project sound hear people bang drill wall span span hellip,0.057,0.75,0.193,0.9184
nice hotel friendly staff workers delicious food breakfast excellent sport facilities locate strategic area little traffic enjoy stay look forward stay recommend hotel,0.0,0.475,0.525,0.9573
never better hotel yogya hyatt regency welcome friendly smile staff check process quite able accommodate request connect room since stay kid beautiful green lovely garden landscape around hotel make us oblivious middle busy area town breakfast amaze various menu options western menu locals,0.041,0.617,0.341,0.9552
everything awesome never service hotels pleasure live one room different experience thank u much welcome family warm smile,0.107,0.393,0.5,0.8751
certainly family hotel outdoor space really big green buffet breakfast lot choice add dim sum menu please room certainly need update staff friendly helpful recommend hotels,0.0,0.562,0.438,0.9274
people beautiful resort make experience better imagine friendly helpful kind extremely beautiful property huge pool pretty golf course local village bar b q customary dance available attend saturday nights,0.0,0.424,0.576,0.9773
nice hotel great view room clean comfortable love garden pool ride andong free perfect staycation kid need go outside hotel save energy kid still get entertain breakfast ok lot option tv chanel,0.0,0.383,0.617,0.986
wanna search quiet place place still around town yogyakarta try place good facilities ambience best place staff helpful,0.0,0.602,0.398,0.872
room little bite old vibes compare star hotel jogja room beautiful view mountain surround hotel good staff helpfull nice entrace lobby nature view ponds also nice,0.0,0.609,0.391,0.91
lovable place meet also spend time family room bath room conference room comfortable food excellent specially red velvet cake wonder whether buy home pool environtment view great,0.0,0.604,0.396,0.9442
beautiful landscape shine water element make feel relax kind staff service wifi connection fast connect devices time need use hot spot great room equipment bite old clean would better renew shower equipment,0.0,0.566,0.434,0.9633
hotel great atmosphere adjacent hole golf range nice landscape good service great food hour round clock room service available disposal great hospitality check check fast precise cleanliness good amenities adequate one thing though compare star hotels feel room could bigger eventhough adequate,0.0,0.579,0.421,0.9741
great hotel great price comfortable stay hope go back day room not new clean comfortable staff friendly helpful pool perfect quite large divide several areas er connect lot greenery even busy still not feel busy choose quiet corner relax also order food pool hotel restaurant also nice breakfast nice terrace huge outside lot tree stay days work trip really able relax feel like home,0.024,0.517,0.46,0.9908
pleasant stay always although hotel quite old service excellent anniversary decorate room personalize travel family need connect room provide even though stay peak season food nice one key difference excellent staff,0.0,0.658,0.342,0.9328
feel like stay home lot love family take care us smile lot activities family service best family enjoy contender holiday best hotel call home,0.0,0.347,0.653,0.9803
kid happy pool friendly staff nice staycation clean room homey breakfast complete lovely place take picture fast respon family friendly clean bathroom great experience stay,0.0,0.394,0.606,0.9781
spacious amp clean bedroom bathroom clean bathtub seem little bite old colour not white yellowish amp little quot crack quot love pool area spacious greeny kid friendly love jog track airy surround find little bite difficult park car maybe stay holiday season nye,0.038,0.622,0.34,0.9551
overall hotel condition good amaze especially garden resto swim pool garden beautiful relax except bike path seem short compare vast area hotel,0.0,0.577,0.423,0.9217
beautiful territory welcome staff room shabby outdated still nicely decorate clean breakfast good choice gluten free allergy order advance bar area small overall not bad price,0.0,0.469,0.531,0.9664
big place big pool nice weather good food take time refill food nicer room fully cover carpet ask golf area view fitness center need clean bathroom hole seem block,0.074,0.585,0.341,0.8591
room breakfast good also humble staff please keep continue good action good attitude hyatt legend name hotel world hopefully improvement things,0.0,0.473,0.527,0.9403
hotel everything need great facilities family big pool ponds fish big garden golf kid play room etc etc many mention breakfast like feast room clean comfortable staff professional helpful friendly kid best time wait go back next year,0.0,0.543,0.457,0.9756
great hotel not smokers still around not outdoors indoors well totally unhealthy kid around food great miss traditional drink beras kencur turmeric tamarind etc,0.207,0.554,0.239,0.4754
nice hotel staff helpful perfect want non smoke floor not available time ok room clean smell like not smoke room perfect stay,0.053,0.396,0.551,0.9486
comfort place friendly staff javanese design complete n delicious breakfast little bite far central yogjakarta golf court big swim pool look food need walk minutes overall satisfy,0.0,0.64,0.36,0.9081
great hotel beautiful scenery swim poll big family enjoy facilities use take andong around hotel like thank hyatt,0.0,0.445,0.555,0.9451
hotel old well maintain wonderful greeneries nice swim pool lot family activities include golf course resort cannot go wrong visit family value money want stay longer relax near pool refurbish room even perfect room become quite old not luxurious compare facilities,0.0,0.606,0.394,0.961
nice resort pool awesome kid activities great nice golf merapi view love free andong ride staff excellent food variety great room hotel old style need renovate back soon thank hyatt yogya keep good work,0.0,0.41,0.59,0.9877
excellence staff polite great service pleasant stay many activity kid fish rid bike golf also rid horse great swim pool buffet breakfast good,0.0,0.493,0.507,0.9612
room old style bath room not clean outdoor activity good family pool great food expectation staff friendly kid recommend stay hotel,0.073,0.517,0.41,0.8871
hotel huge stunningly beautifully situate minutes city let scare away food hotel surround area good sure spend least day hotel enjoy facilities,0.095,0.476,0.429,0.8807
title one night not enough stay beautiful place clean food delish important one customer service humble helpful always give smile not regret stay amaze hotel,0.166,0.498,0.336,0.6293
experience stay hyatt regency yogyakarta well expectations moment arrive hotel surprise attention give us staff arrive escort immediately regency club lounge check staff lounge accommodate one stand among rest ms melryna help us literally everything stay sightsee service breakfast transfer also appreciate remember name personally greet us every time arrive lounge hotel timeless charm javanese ambiance destination enjoy variety breakfast options also ala carte din overall hyatt regency yogyakarta span span hellip,0.0,0.785,0.215,0.9413
come yogyakarta daughter come school trip really love hyatt great hotel kid waterslide rope swing golf fish boys time live play non stop day even teenagers fun time hotel could use refresh price value amaze well worth staff friendly always helpful massage wonderful breakfast buffet huge wide variety foods,0.029,0.482,0.488,0.9864
view wonderful service excellent kind servant excellent facilities suitable family couple vacation location not far central yogyakarta also provide shuttle malioboro,0.0,0.54,0.46,0.9382
hotel clean comfort hospitality ambience landscape wonderfull jog track golf pool cool nice good landscape food delicious breakfast cocktail overall stay wonderfull,0.0,0.486,0.514,0.9423
customer since single spacious area include tropical jungle swim pool golf course garden many friendly staff great selection food room need upgrade little bite though maintain rustic traditional feel definitely come back,0.0,0.744,0.256,0.875
never stay hyatt regency first experience surprise warm good service good food items taste way present food also interest excellence,0.0,0.453,0.547,0.9423
first time properly visit yogjakarta absolutely love stay hyatt staff welcome moment arrive greet flower necklace serve refresher wait check check room welcome assortment fruit tasty room great view golf course hotel next door sasanti restaurant offer indonesian amp western food fun fact obama visit restaurant highly recommend hyatt yogjakarta anyone visit,0.0,0.662,0.338,0.9719
hotel good staff matter process r reputation staff make difference hyatt regency staff superb visit yoja last month first time years decision stay hyatt vindicate good comfortable clean room good food excellent service love golf course garden outdoor restaurant excellent nothing problem chef serve staff look forward return another time,0.0,0.513,0.487,0.9862
